{
  "version": 3,
  "songs": [],
  "playlists": [],
  "settings": {
    "dataSchemaVersion": 4,
    "tags": [],
    "theme": "dark",
    "lyricsFontSize": 18,
    "showBottomPlayer": true,
    "spotlight": true,
    "shuffle": false,
    "repeat": "off",
    "autoScroll": true,
    "volume": 80,
    "mainPage": "player",
    "startupPage": "player",
    "compactMode": false,
    "showArtwork": true,
    "glassEffect": true,
    "reduceMotion": false,
    "helpTips": true
  }
}
